{"kind":"message-definition","version":{"major":0,"minor":1},"producer":{"id":"dev.intlify/resource-definition","revision":"0.1.0"},"source":{"namespace":{"kind":"project"},"path":["locales","en.json"]},"logicalAliases":[["resources","en.json"]],"inputFingerprint":{"algorithm":"blake3-256","digest":"000102030405060708090a0b0c0d0e0f101112131415161718191a1b1c1d1e1f"},"definitions":[{"scope":{"namespace":{"kind":"project"},"name":"app"},"domain":"json-pointer","key":"","locale":"en","message":"","source":{"structuralPath":"","occurrence":0}},{"scope":{"namespace":{"kind":"project"},"name":"app"},"domain":"json-pointer","key":"/title","locale":"en","message":"Hello, {$name}\n","source":{"structuralPath":"/title","occurrence":0}}]}
